{"schema_version":"1.0.0","case_id":"case-demo-20260927","finding_id":"finding-demo-001","finding_version":1,"entity_ref":"address:bcrt1qdemosynthetic001","window_start":"2026-01-01T00:00:00Z","window_end":"2026-01-01T01:00:00Z","snapshot_id":"snapshot-demo-001","feature_vector_hash":"3333333333333333333333333333333333333333333333333333333333333333","method_digest":"4444444444444444444444444444444444444444444444444444444444444444","raw_score":null,"rank":null,"coverage":{"complete":false,"notes":["Example only; no Phase 0 model exists."]},"explanations":[],"source_refs":[{"evidence_id":"ev-demo-transactions","source_sha256":"0000000000000000000000000000000000000000000000000000000000000000","locator_type":"synthetic","locator":"transaction:1","byte_start":null,"byte_end":null}]}
